{
  "$schema": "http://json-schema.org/draft-07/schema#",
  "$ref": "#/definitions/PaymentGatewayInteractionLog",
  "definitions": {
    "PaymentGatewayInteractionLog": {
      "description": "A record of all messages exchanged with merchants, made via the payment gateway, for authorizations and payments",
      "type": "object",
      "additionalProperties": true,
      "required": [
        "id",
        "paymentGatewayInteractionType",
        "referencedEntityId",
        "paymentGatewayInteractionStatus",
        "paymentGatewayDateTime",
        "paymentGatewayResultCode"
      ],
      "properties": {
        "id": {
          "anyOf": [
            {
              "type": "string"
            },
            {
              "type": "null"
            }
          ],
          "description": "Unique identifier for the entity, can be null on create if auto-generated"
        },
        "name": {
          "type": "string",
          "description": "Short name of the payment gateway interaction log entry"
        },
        "paymentGatewayInteractionType": {
          "type": "string",
          "description": "Type of interaction with the gateway for the log entry, such as a CardPayment or RefundPayment"
        },
        "referencedEntityId": {
          "type": "string",
          "description": "References the primary entity involved in the interaction, such as a CardPayment or RefundPayment"
        },
        "paymentGatewayInteractionStatus": {
          "type": "string",
          "description": "Status of the interaction, such as Success or Timeout"
        },
        "paymentGatewayDateTime": {
          "type": "string",
          "description": "Datetime provided by the gateway after successful communication",
          "format": "date-time"
        },
        "paymentGatewayReferenceNumber": {
          "type": "string",
          "description": "Unique transaction identifier generated by payment gateway"
        },
        "paymentGatewayAuthorizationCode": {
          "type": "string",
          "description": "Authorization approval code sent back by the gateway"
        },
        "paymentGatewayResultCode": {
          "type": "string",
          "description": "Result code returned by the gateway"
        },
        "paymentGatewayAvsCode": {
          "type": "string",
          "description": "Unique code assigned by the gateway for address verification"
        },
        "paymentGatewayInternalReferenceNumber": {
          "type": "string",
          "description": "Unique transaction identifier generated by the internal payment platform"
        },
        "paymentGatewayInternalResultCode": {
          "type": "string",
          "description": "Internal result code returned by the internal payment platform"
        },
        "paymentGatewayMessageText": {
          "type": "string",
          "description": "Message sent by the payment gateway"
        },
        "auditInfo": {
          "type": "object",
          "description": "Audit information for the entity",
          "additionalProperties": true,
          "required": [
            "createdBy",
            "isDeleted",
            "updatedBy",
            "updatedDate",
            "createdDate"
          ],
          "properties": {
            "createdDate": {
              "anyOf": [
                {
                  "type": "string",
                  "format": "date-time"
                },
                {
                  "type": "null"
                }
              ],
              "description": "Timestamp of when the entity was created"
            },
            "createdBy": {
              "type": "string",
              "description": "Identifies the system or user which created the entity"
            },
            "updatedDate": {
              "anyOf": [
                {
                  "type": "string",
                  "format": "date-time"
                },
                {
                  "type": "null"
                }
              ],
              "description": "Timestamp of when the entity was last updated"
            },
            "updatedBy": {
              "type": "string",
              "description": "Identifies the system or user which last updated the entity"
            },
            "isDeleted": {
              "anyOf": [
                {
                  "type": "boolean"
                },
                {
                  "type": "null"
                }
              ],
              "description": "Indicates whether or not the entity has been soft-deleted"
            }
          }
        }
      }
    }
  }
}