{
  "id": "ee315481-1665-463a-8d0d-700ea24d4b87",
  "name": "Authorization attempt",
  "paymentGatewayInteractionType": "Auth",
  "referencedEntityId": "1de8ed0e-02ad-11ed-b939-0242ac120002",
  "paymentGatewayInteractionStatus": "Success",
  "paymentGatewayDateTime": "2023-04-21T01:13:12.924Z",
  "paymentGatewayReferenceNumber": "8B566A5B-8C2F-47E7-A4EC-18C26001ADEA",
  "paymentGatewayAuthorizationCode": "542845",
  "paymentGatewayResultCode": "100",
  "paymentGatewayAvsCode": "",
  "paymentGatewayInternalReferenceNumber": "",
  "paymentGatewayInternalResultCode": "",
  "paymentGatewayMessageText": "No errors",
  "auditInfo": {
    "createdDate": "2021-04-21T01:12:28.801Z",
    "createdBy": "Application Admin",
    "updatedDate": "2021-04-21T01:12:28.801Z",
    "updatedBy": "Application Admin",
    "isDeleted": false
  }
}